{
  "schema_id": "kolibri.product.run.execute.v1_3.command",
  "schema_version": "1.3",
  "tenant_id": "tenant_01J00000000000000000000000",
  "project_id": "project_01J0000000000000000000000",
  "thread_id": "thread_01J00000000000000000000000",
  "run_id": "run_01J000000000000000000000000",
  "input_message_id": "message_01J000000000000000000000",
  "case_id": "case_01J00000000000000000000000",
  "goal_id": "goal_01J00000000000000000000000",
  "prompt": "Проверь репозиторий и исправь найденную ошибку.",
  "prompt_hash": "sha256:ae6782d5969a77dd0eb4da23181cf2af0aec44d64f6fc983af82060d2a1ee081",
  "execution_mode": "developer",
  "runtime_profile": "agent-runtime-profile-01",
  "model": "model-selection-01",
  "reasoning_effort": "high",
  "service_tier": "priority",
  "workspace_ref": "repository",
  "access_mode": "full",
  "sandbox": "danger-full-access",
  "approval_policy": "never",
  "reviewer": null,
  "requester_role": "owner",
  "trusted_agent_profile_id": "tap_aaaaaaaaaaaaaaaaaaaaaaaaaaaaaaaa",
  "trusted_agent_profile_epoch": 7,
  "trusted_agent_workspace_binding_id": "wsb_bbbbbbbbbbbbbbbbbbbbbbbbbbbbbbbb",
  "trusted_agent_workspace_binding_epoch": 11
}
